author,published,title,text,site_url,,,,,,,,,,,,,,,,,,,,,,,,,,,,,,,,,,,,,,,,,,,,,,,,,,,,,,,,,,,,,,,,,,,,,,,,,,,,,,,,,,,,,,,,,,,,,,,,,,,,,,,,,,,,,
bbc,26-Oct-17,Would you share your internet for cash?," For those living in countries like China, where the internet is heavily restricted, one way to get access to the open web is via a virtual private network, or VPN. For those living in countries like China, where the internet is heavily restricted, one way to get access to the open web is via a virtual private network, or VPN. For those living in countries like China, where the internet is heavily restricted, one way to get access to the open web is via a virtual private network, or VPN. For those living in countries like China, where the internet is heavily restricted, one way to get access to the open web is via a virtual private network, or VPN. For those living in countries like China, where the internet is heavily restricted, one way to get access to the open web is via a virtual private network, or VPN. For those living in countries like China, where the internet is heavily restricted, one way to get access to the open web is via a virtual private network, or VPN. For those living in countries like China, where the internet is heavily restricted, one way to get access to the open web is via a virtual private network, or VPN. For those living in countries like China, where the internet is heavily restricted, one way to get access to the open web is via a virtual private network, or VPN. For those living in countries like China, where the internet is heavily restricted, one way to get access to the open web is via a virtual private network, or VPN. For those living in countries like China, where the internet is heavily restricted, one way to get access to the open web is via a virtual private network, or VPN. For those living in countries like China, where the internet is heavily restricted, one way to get access to the open web is via a virtual private network, or VPN. For those living in countries like China, where the internet is heavily restricted, one way to get access to the open web is via a virtual private network, or VPN. For those living in countries like China, where the internet is heavily restricted, one way to get access to the open web is via a virtual private network, or VPN. For those living in countries like China, where the internet is heavily restricted, one way to get access to the open web is via a virtual private network, or VPN. For those living in countries like China, where the internet is heavily restricted, one way to get access to the open web is via a virtual private network, or VPN. For those living in countries like China, where the internet is heavily restricted, one way to get access to the open web is via a virtual private network, or VPN. For those living in countries like China, where the internet is heavily restricted, one way to get access to the open web is via a virtual private network, or VPN. For those living in countries like China, where the internet is heavily restricted, one way to get access to the open web is via a virtual private network, or VPN. For those living in countries like China, where the internet is heavily restricted, one way to get access to the open web is via a virtual private network, or VPN. For those living in countries like China, where the internet is heavily restricted, one way to get access to the open web is via a virtual private network, or VPN. For those living in countries like China, where the internet is heavily restricted, one way to get access to the open web is via a virtual private network, or VPN. For those living in countries like China, where the internet is heavily restricted, one way to get access to the open web is via a virtual private network, or VPN. For those living in countries like China, where the internet is heavily restricted, one way to get access to the open web is via a virtual private network, or VPN. For those living in countries like China, where the internet is heavily restricted, one way to get access to the open web is via a virtual private network, or VPN. For those living in countries like China, where the internet is heavily restricted, one way to get access to the open web is via a virtual private network, or VPN. For those living in countries like China, where the internet is heavily restricted, one way to get access to the open web is via a virtual private network, or VPN. For those living in countries like China, where the internet is heavily restricted, one way to get access to the open web is via a virtual private network, or VPN. For those living in countries like China, where the internet is heavily restricted, one way to get access to the open web is via a virtual private network, or VPN. For those living in countries like China, where the internet is heavily restricted, one way to get access to the open web is via a virtual private network, or VPN. For those living in countries like China, where the internet is heavily restricted, one way to get access to the open web is via a virtual private network, or VPN. For those living in countries like China, where the internet is heavily restricted, one way to get access to the open web is via a virtual private network, or VPN. For those living in countries like China, where the internet is heavily restricted, one way to get access to the open web is via a virtual private network, or VPN. For those living in countries like China, where the internet is heavily restricted, one way to get access to the open web is via a virtual private network, or VPN. For those living in countries like China, where the internet is heavily restricted, one way to get access to the open web is via a virtual private network, or VPN. For those living in countries like China, where the internet is heavily restricted, one way to get access to the open web is via a virtual private network, or VPN.",http://www.bbc.com/news/technology-41758407,,,,,,,,,,,,,,,,,,,,,,,,,,,,,,,,,,,,,,,,,,,,,,,,,,,,,,,,,,,,,,,,,,,,,,,,,,,,,,,,,,,,,,,,,,,,,,,,,,,,,,,,,,,,,
bbc,22-May-17,"Bitcoin hits $2,000 trading high point"," The value of Bitcoin has hit a new high with each individual coin now worth more than $2,100 (1,615). The value of Bitcoin has hit a new high with each individual coin now worth more than $2,100 (1,615). The value of Bitcoin has hit a new high with each individual coin now worth more than $2,100 (1,615). The value of Bitcoin has hit a new high with each individual coin now worth more than $2,100 (1,615). The value of Bitcoin has hit a new high with each individual coin now worth more than $2,100 (1,615). The value of Bitcoin has hit a new high with each individual coin now worth more than $2,100 (1,615). The value of Bitcoin has hit a new high with each individual coin now worth more than $2,100 (1,615). The value of Bitcoin has hit a new high with each individual coin now worth more than $2,100 (1,615). The value of Bitcoin has hit a new high with each individual coin now worth more than $2,100 (1,615). The value of Bitcoin has hit a new high with each individual coin now worth more than $2,100 (1,615). The value of Bitcoin has hit a new high with each individual coin now worth more than $2,100 (1,615). The value of Bitcoin has hit a new high with each individual coin now worth more than $2,100 (1,615).",http://www.bbc.com/news/technology-39997585,,,,,,,,,,,,,,,,,,,,,,,,,,,,,,,,,,,,,,,,,,,,,,,,,,,,,,,,,,,,,,,,,,,,,,,,,,,,,,,,,,,,,,,,,,,,,,,,,,,,,,,,,,,,,
bbc,29-Mar-17,Bitcoin entrepreneur Amir Taaki quizzed over fighting in Syria," A London-based software developer and ""hacker"" has said he is under police investigation after going to Syria to fight against the Islamic State group. A London-based software developer and ""hacker"" has said he is under police investigation after going to Syria to fight against the Islamic State group. A London-based software developer and ""hacker"" has said he is under police investigation after going to Syria to fight against the Islamic State group. A London-based software developer and ""hacker"" has said he is under police investigation after going to Syria to fight against the Islamic State group. A London-based software developer and ""hacker"" has said he is under police investigation after going to Syria to fight against the Islamic State group. A London-based software developer and ""hacker"" has said he is under police investigation after going to Syria to fight against the Islamic State group. A London-based software developer and ""hacker"" has said he is under police investigation after going to Syria to fight against the Islamic State group. A London-based software developer and ""hacker"" has said he is under police investigation after going to Syria to fight against the Islamic State group. A London-based software developer and ""hacker"" has said he is under police investigation after going to Syria to fight against the Islamic State group. A London-based software developer and ""hacker"" has said he is under police investigation after going to Syria to fight against the Islamic State group. A London-based software developer and ""hacker"" has said he is under police investigation after going to Syria to fight against the Islamic State group. A London-based software developer and ""hacker"" has said he is under police investigation after going to Syria to fight against the Islamic State group. A London-based software developer and ""hacker"" has said he is under police investigation after going to Syria to fight against the Islamic State group. A London-based software developer and ""hacker"" has said he is under police investigation after going to Syria to fight against the Islamic State group. A London-based software developer and ""hacker"" has said he is under police investigation after going to Syria to fight against the Islamic State group. A London-based software developer and ""hacker"" has said he is under police investigation after going to Syria to fight against the Islamic State group. A London-based software developer and ""hacker"" has said he is under police investigation after going to Syria to fight against the Islamic State group. A London-based software developer and ""hacker"" has said he is under police investigation after going to Syria to fight against the Islamic State group. A London-based software developer and ""hacker"" has said he is under police investigation after going to Syria to fight against the Islamic State group. A London-based software developer and ""hacker"" has said he is under police investigation after going to Syria to fight against the Islamic State group. A London-based software developer and ""hacker"" has said he is under police investigation after going to Syria to fight against the Islamic State group. A London-based software developer and ""hacker"" has said he is under police investigation after going to Syria to fight against the Islamic State group. A London-based software developer and ""hacker"" has said he is under police investigation after going to Syria to fight against the Islamic State group. A London-based software developer and ""hacker"" has said he is under police investigation after going to Syria to fight against the Islamic State group. A London-based software developer and ""hacker"" has said he is under police investigation after going to Syria to fight against the Islamic State group. A London-based software developer and ""hacker"" has said he is under police investigation after going to Syria to fight against the Islamic State group. A London-based software developer and ""hacker"" has said he is under police investigation after going to Syria to fight against the Islamic State group. A London-based software developer and ""hacker"" has said he is under police investigation after going to Syria to fight against the Islamic State group. A London-based software developer and ""hacker"" has said he is under police investigation after going to Syria to fight against the Islamic State group. A London-based software developer and ""hacker"" has said he is under police investigation after going to Syria to fight against the Islamic State group. A London-based software developer and ""hacker"" has said he is under police investigation after going to Syria to fight against the Islamic State group. A London-based software developer and ""hacker"" has said he is under police investigation after going to Syria to fight against the Islamic State group. A London-based software developer and ""hacker"" has said he is under police investigation after going to Syria to fight against the Islamic State group. A London-based software developer and ""hacker"" has said he is under police investigation after going to Syria to fight against the Islamic State group. A London-based software developer and ""hacker"" has said he is under police investigation after going to Syria to fight against the Islamic State group. A London-based software developer and ""hacker"" has said he is under police investigation after going to Syria to fight against the Islamic State group.",http://www.bbc.com/news/uk-39417937,,,,,,,,,,,,,,,,,,,,,,,,,,,,,,,,,,,,,,,,,,,,,,,,,,,,,,,,,,,,,,,,,,,,,,,,,,,,,,,,,,,,,,,,,,,,,,,,,,,,,,,,,,,,,
bbc,3-Jan-17,"Bitcoin digital currency hits three-year high of $1,000"," Digital currency Bitcoin has seen its value top $1,000 (815) for the first time in three years after it ended as the best-performing currency of 2016. Digital currency Bitcoin has seen its value top $1,000 (815) for the first time in three years after it ended as the best-performing currency of 2016. Digital currency Bitcoin has seen its value top $1,000 (815) for the first time in three years after it ended as the best-performing currency of 2016. Digital currency Bitcoin has seen its value top $1,000 (815) for the first time in three years after it ended as the best-performing currency of 2016. Digital currency Bitcoin has seen its value top $1,000 (815) for the first time in three years after it ended as the best-performing currency of 2016. Digital currency Bitcoin has seen its value top $1,000 (815) for the first time in three years after it ended as the best-performing currency of 2016. Digital currency Bitcoin has seen its value top $1,000 (815) for the first time in three years after it ended as the best-performing currency of 2016. Digital currency Bitcoin has seen its value top $1,000 (815) for the first time in three years after it ended as the best-performing currency of 2016. Digital currency Bitcoin has seen its value top $1,000 (815) for the first time in three years after it ended as the best-performing currency of 2016. Digital currency Bitcoin has seen its value top $1,000 (815) for the first time in three years after it ended as the best-performing currency of 2016. Digital currency Bitcoin has seen its value top $1,000 (815) for the first time in three years after it ended as the best-performing currency of 2016. Digital currency Bitcoin has seen its value top $1,000 (815) for the first time in three years after it ended as the best-performing currency of 2016. Digital currency Bitcoin has seen its value top $1,000 (815) for the first time in three years after it ended as the best-performing currency of 2016. Digital currency Bitcoin has seen its value top $1,000 (815) for the first time in three years after it ended as the best-performing currency of 2016. Digital currency Bitcoin has seen its value top $1,000 (815) for the first time in three years after it ended as the best-performing currency of 2016. Digital currency Bitcoin has seen its value top $1,000 (815) for the first time in three years after it ended as the best-performing currency of 2016. Digital currency Bitcoin has seen its value top $1,000 (815) for the first time in three years after it ended as the best-performing currency of 2016. Digital currency Bitcoin has seen its value top $1,000 (815) for the first time in three years after it ended as the best-performing currency of 2016. Digital currency Bitcoin has seen its value top $1,000 (815) for the first time in three years after it ended as the best-performing currency of 2016. Digital currency Bitcoin has seen its value top $1,000 (815) for the first time in three years after it ended as the best-performing currency of 2016. Digital currency Bitcoin has seen its value top $1,000 (815) for the first time in three years after it ended as the best-performing currency of 2016. Digital currency Bitcoin has seen its value top $1,000 (815) for the first time in three years after it ended as the best-performing currency of 2016. Digital currency Bitcoin has seen its value top $1,000 (815) for the first time in three years after it ended as the best-performing currency of 2016. Digital currency Bitcoin has seen its value top $1,000 (815) for the first time in three years after it ended as the best-performing currency of 2016. Digital currency Bitcoin has seen its value top $1,000 (815) for the first time in three years after it ended as the best-performing currency of 2016. Digital currency Bitcoin has seen its value top $1,000 (815) for the first time in three years after it ended as the best-performing currency of 2016. Digital currency Bitcoin has seen its value top $1,000 (815) for the first time in three years after it ended as the best-performing currency of 2016. Digital currency Bitcoin has seen its value top $1,000 (815) for the first time in three years after it ended as the best-performing currency of 2016. Digital currency Bitcoin has seen its value top $1,000 (815) for the first time in three years after it ended as the best-performing currency of 2016. Digital currency Bitcoin has seen its value top $1,000 (815) for the first time in three years after it ended as the best-performing currency of 2016. Digital currency Bitcoin has seen its value top $1,000 (815) for the first time in three years after it ended as the best-performing currency of 2016.",http://www.bbc.com/news/business-38495804,,,,,,,,,,,,,,,,,,,,,,,,,,,,,,,,,,,,,,,,,,,,,,,,,,,,,,,,,,,,,,,,,,,,,,,,,,,,,,,,,,,,,,,,,,,,,,,,,,,,,,,,,,,,,
bbc,22-Jul-16,US man jailed over bitcoin fraud scheme, A Texan man has been sentenced to 18 months in jail for running a fraudulent Ponzi-style scheme based around the Bitcoin virtual currency. A Texan man has been sentenced to 18 months in jail for running a fraudulent Ponzi-style scheme based around the Bitcoin virtual currency. A Texan man has been sentenced to 18 months in jail for running a fraudulent Ponzi-style scheme based around the Bitcoin virtual currency. A Texan man has been sentenced to 18 months in jail for running a fraudulent Ponzi-style scheme based around the Bitcoin virtual currency. A Texan man has been sentenced to 18 months in jail for running a fraudulent Ponzi-style scheme based around the Bitcoin virtual currency. A Texan man has been sentenced to 18 months in jail for running a fraudulent Ponzi-style scheme based around the Bitcoin virtual currency. A Texan man has been sentenced to 18 months in jail for running a fraudulent Ponzi-style scheme based around the Bitcoin virtual currency. A Texan man has been sentenced to 18 months in jail for running a fraudulent Ponzi-style scheme based around the Bitcoin virtual currency. A Texan man has been sentenced to 18 months in jail for running a fraudulent Ponzi-style scheme based around the Bitcoin virtual currency. A Texan man has been sentenced to 18 months in jail for running a fraudulent Ponzi-style scheme based around the Bitcoin virtual currency. A Texan man has been sentenced to 18 months in jail for running a fraudulent Ponzi-style scheme based around the Bitcoin virtual currency.,http://www.bbc.co.uk/news/technology-36865208,,,,,,,,,,,,,,,,,,,,,,,,,,,,,,,,,,,,,,,,,,,,,,,,,,,,,,,,,,,,,,,,,,,,,,,,,,,,,,,,,,,,,,,,,,,,,,,,,,,,,,,,,,,,,
bbc,8-Aug-16,Bitfinex users to share 36% of bitcoin losses after hack, People who stored bitcoins at a popular exchange have been told they will lose 36% of their assets following a cyber-attack. People who stored bitcoins at a popular exchange have been told they will lose 36% of their assets following a cyber-attack. People who stored bitcoins at a popular exchange have been told they will lose 36% of their assets following a cyber-attack. People who stored bitcoins at a popular exchange have been told they will lose 36% of their assets following a cyber-attack. People who stored bitcoins at a popular exchange have been told they will lose 36% of their assets following a cyber-attack. People who stored bitcoins at a popular exchange have been told they will lose 36% of their assets following a cyber-attack. People who stored bitcoins at a popular exchange have been told they will lose 36% of their assets following a cyber-attack. People who stored bitcoins at a popular exchange have been told they will lose 36% of their assets following a cyber-attack. People who stored bitcoins at a popular exchange have been told they will lose 36% of their assets following a cyber-attack. People who stored bitcoins at a popular exchange have been told they will lose 36% of their assets following a cyber-attack. People who stored bitcoins at a popular exchange have been told they will lose 36% of their assets following a cyber-attack. People who stored bitcoins at a popular exchange have been told they will lose 36% of their assets following a cyber-attack. People who stored bitcoins at a popular exchange have been told they will lose 36% of their assets following a cyber-attack. People who stored bitcoins at a popular exchange have been told they will lose 36% of their assets following a cyber-attack. People who stored bitcoins at a popular exchange have been told they will lose 36% of their assets following a cyber-attack. People who stored bitcoins at a popular exchange have been told they will lose 36% of their assets following a cyber-attack. People who stored bitcoins at a popular exchange have been told they will lose 36% of their assets following a cyber-attack. People who stored bitcoins at a popular exchange have been told they will lose 36% of their assets following a cyber-attack. People who stored bitcoins at a popular exchange have been told they will lose 36% of their assets following a cyber-attack.,http://www.bbc.com/news/technology-37009319,,,,,,,,,,,,,,,,,,,,,,,,,,,,,,,,,,,,,,,,,,,,,,,,,,,,,,,,,,,,,,,,,,,,,,,,,,,,,,,,,,,,,,,,,,,,,,,,,,,,,,,,,,,,,
bbc,28-Oct-17,Alex Bessell charged over Google cyber attack," A man has been charged with a series of cybercrime offences, including creating and selling malware. A man has been charged with a series of cybercrime offences, including creating and selling malware. A man has been charged with a series of cybercrime offences, including creating and selling malware. A man has been charged with a series of cybercrime offences, including creating and selling malware.",http://www.bbc.co.uk/news/uk-england-birmingham-41788720,,,,,,,,,,,,,,,,,,,,,,,,,,,,,,,,,,,,,,,,,,,,,,,,,,,,,,,,,,,,,,,,,,,,,,,,,,,,,,,,,,,,,,,,,,,,,,,,,,,,,,,,,,,,,
bbc,24-Oct-17,Google phone hit by 'burn in' problems, Googles new flagship smartphones have been hit by complaints about the quality of the screens. Googles new flagship smartphones have been hit by complaints about the quality of the screens. Googles new flagship smartphones have been hit by complaints about the quality of the screens. Googles new flagship smartphones have been hit by complaints about the quality of the screens. Googles new flagship smartphones have been hit by complaints about the quality of the screens. Googles new flagship smartphones have been hit by complaints about the quality of the screens. Googles new flagship smartphones have been hit by complaints about the quality of the screens. Googles new flagship smartphones have been hit by complaints about the quality of the screens. Googles new flagship smartphones have been hit by complaints about the quality of the screens. Googles new flagship smartphones have been hit by complaints about the quality of the screens. Googles new flagship smartphones have been hit by complaints about the quality of the screens. Googles new flagship smartphones have been hit by complaints about the quality of the screens. Googles new flagship smartphones have been hit by complaints about the quality of the screens. Googles new flagship smartphones have been hit by complaints about the quality of the screens. Googles new flagship smartphones have been hit by complaints about the quality of the screens. Googles new flagship smartphones have been hit by complaints about the quality of the screens. Googles new flagship smartphones have been hit by complaints about the quality of the screens. Googles new flagship smartphones have been hit by complaints about the quality of the screens.,http://www.bbc.com/news/technology-41730636,,,,,,,,,,,,,,,,,,,,,,,,,,,,,,,,,,,,,,,,,,,,,,,,,,,,,,,,,,,,,,,,,,,,,,,,,,,,,,,,,,,,,,,,,,,,,,,,,,,,,,,,,,,,,
