author,published,title,text,site_url,,,,,,,,,,,,,,,,,,,,,,,,,,,,,,,,,,,,,,,,,,,,,,,,,,,,,,,,,,,,,,,,,,,,,,,,,,,,,,,,,,,,,,,,,,,,,,,,,,,,,,,,,,,,,
bbc,27-Oct-17,Why is it so difficult to discover new antibiotics?, Over-reliance on and misuse of antibiotics has led to warnings of a future without effective medicines. Why is it so difficult for scientists to discover new drugs? Over-reliance on and misuse of antibiotics has led to warnings of a future without effective medicines. Why is it so difficult for scientists to discover new drugs? Over-reliance on and misuse of antibiotics has led to warnings of a future without effective medicines. Why is it so difficult for scientists to discover new drugs? Over-reliance on and misuse of antibiotics has led to warnings of a future without effective medicines. Why is it so difficult for scientists to discover new drugs? Over-reliance on and misuse of antibiotics has led to warnings of a future without effective medicines. Why is it so difficult for scientists to discover new drugs? Over-reliance on and misuse of antibiotics has led to warnings of a future without effective medicines. Why is it so difficult for scientists to discover new drugs? Over-reliance on and misuse of antibiotics has led to warnings of a future without effective medicines. Why is it so difficult for scientists to discover new drugs? Over-reliance on and misuse of antibiotics has led to warnings of a future without effective medicines. Why is it so difficult for scientists to discover new drugs? Over-reliance on and misuse of antibiotics has led to warnings of a future without effective medicines. Why is it so difficult for scientists to discover new drugs? Over-reliance on and misuse of antibiotics has led to warnings of a future without effective medicines. Why is it so difficult for scientists to discover new drugs? Over-reliance on and misuse of antibiotics has led to warnings of a future without effective medicines. Why is it so difficult for scientists to discover new drugs? Over-reliance on and misuse of antibiotics has led to warnings of a future without effective medicines. Why is it so difficult for scientists to discover new drugs? Over-reliance on and misuse of antibiotics has led to warnings of a future without effective medicines. Why is it so difficult for scientists to discover new drugs? Over-reliance on and misuse of antibiotics has led to warnings of a future without effective medicines. Why is it so difficult for scientists to discover new drugs? Over-reliance on and misuse of antibiotics has led to warnings of a future without effective medicines. Why is it so difficult for scientists to discover new drugs? Over-reliance on and misuse of antibiotics has led to warnings of a future without effective medicines. Why is it so difficult for scientists to discover new drugs? Over-reliance on and misuse of antibiotics has led to warnings of a future without effective medicines. Why is it so difficult for scientists to discover new drugs? Over-reliance on and misuse of antibiotics has led to warnings of a future without effective medicines. Why is it so difficult for scientists to discover new drugs? Over-reliance on and misuse of antibiotics has led to warnings of a future without effective medicines. Why is it so difficult for scientists to discover new drugs? Over-reliance on and misuse of antibiotics has led to warnings of a future without effective medicines. Why is it so difficult for scientists to discover new drugs? Over-reliance on and misuse of antibiotics has led to warnings of a future without effective medicines. Why is it so difficult for scientists to discover new drugs? Over-reliance on and misuse of antibiotics has led to warnings of a future without effective medicines. Why is it so difficult for scientists to discover new drugs? Over-reliance on and misuse of antibiotics has led to warnings of a future without effective medicines. Why is it so difficult for scientists to discover new drugs? Over-reliance on and misuse of antibiotics has led to warnings of a future without effective medicines. Why is it so difficult for scientists to discover new drugs? Over-reliance on and misuse of antibiotics has led to warnings of a future without effective medicines. Why is it so difficult for scientists to discover new drugs? Over-reliance on and misuse of antibiotics has led to warnings of a future without effective medicines. Why is it so difficult for scientists to discover new drugs? Over-reliance on and misuse of antibiotics has led to warnings of a future without effective medicines. Why is it so difficult for scientists to discover new drugs? Over-reliance on and misuse of antibiotics has led to warnings of a future without effective medicines. Why is it so difficult for scientists to discover new drugs? Over-reliance on and misuse of antibiotics has led to warnings of a future without effective medicines. Why is it so difficult for scientists to discover new drugs? Over-reliance on and misuse of antibiotics has led to warnings of a future without effective medicines. Why is it so difficult for scientists to discover new drugs? Over-reliance on and misuse of antibiotics has led to warnings of a future without effective medicines. Why is it so difficult for scientists to discover new drugs? Over-reliance on and misuse of antibiotics has led to warnings of a future without effective medicines. Why is it so difficult for scientists to discover new drugs? Over-reliance on and misuse of antibiotics has led to warnings of a future without effective medicines. Why is it so difficult for scientists to discover new drugs? Over-reliance on and misuse of antibiotics has led to warnings of a future without effective medicines. Why is it so difficult for scientists to discover new drugs? Over-reliance on and misuse of antibiotics has led to warnings of a future without effective medicines. Why is it so difficult for scientists to discover new drugs? Over-reliance on and misuse of antibiotics has led to warnings of a future without effective medicines. Why is it so difficult for scientists to discover new drugs? Over-reliance on and misuse of antibiotics has led to warnings of a future without effective medicines. Why is it so difficult for scientists to discover new drugs? Over-reliance on and misuse of antibiotics has led to warnings of a future without effective medicines. Why is it so difficult for scientists to discover new drugs? Over-reliance on and misuse of antibiotics has led to warnings of a future without effective medicines. Why is it so difficult for scientists to discover new drugs? Over-reliance on and misuse of antibiotics has led to warnings of a future without effective medicines. Why is it so difficult for scientists to discover new drugs? Over-reliance on and misuse of antibiotics has led to warnings of a future without effective medicines. Why is it so difficult for scientists to discover new drugs? Over-reliance on and misuse of antibiotics has led to warnings of a future without effective medicines. Why is it so difficult for scientists to discover new drugs? Over-reliance on and misuse of antibiotics has led to warnings of a future without effective medicines. Why is it so difficult for scientists to discover new drugs? Over-reliance on and misuse of antibiotics has led to warnings of a future without effective medicines. Why is it so difficult for scientists to discover new drugs? Over-reliance on and misuse of antibiotics has led to warnings of a future without effective medicines. Why is it so difficult for scientists to discover new drugs? Over-reliance on and misuse of antibiotics has led to warnings of a future without effective medicines. Why is it so difficult for scientists to discover new drugs? Over-reliance on and misuse of antibiotics has led to warnings of a future without effective medicines. Why is it so difficult for scientists to discover new drugs? Over-reliance on and misuse of antibiotics has led to warnings of a future without effective medicines. Why is it so difficult for scientists to discover new drugs? Over-reliance on and misuse of antibiotics has led to warnings of a future without effective medicines. Why is it so difficult for scientists to discover new drugs? Over-reliance on and misuse of antibiotics has led to warnings of a future without effective medicines. Why is it so difficult for scientists to discover new drugs? Over-reliance on and misuse of antibiotics has led to warnings of a future without effective medicines. Why is it so difficult for scientists to discover new drugs? Over-reliance on and misuse of antibiotics has led to warnings of a future without effective medicines. Why is it so difficult for scientists to discover new drugs? Over-reliance on and misuse of antibiotics has led to warnings of a future without effective medicines. Why is it so difficult for scientists to discover new drugs? Over-reliance on and misuse of antibiotics has led to warnings of a future without effective medicines. Why is it so difficult for scientists to discover new drugs? Over-reliance on and misuse of antibiotics has led to warnings of a future without effective medicines. Why is it so difficult for scientists to discover new drugs?,http://www.bbc.com/news/health-41693229,,,,,,,,,,,,,,,,,,,,,,,,,,,,,,,,,,,,,,,,,,,,,,,,,,,,,,,,,,,,,,,,,,,,,,,,,,,,,,,,,,,,,,,,,,,,,,,,,,,,,,,,,,,,,
bbc,25-Oct-17,Why opioids are such an American problem," When it comes to taking opioids, the United States has the dubious honour of leading the world. When it comes to taking opioids, the United States has the dubious honour of leading the world. When it comes to taking opioids, the United States has the dubious honour of leading the world. When it comes to taking opioids, the United States has the dubious honour of leading the world. When it comes to taking opioids, the United States has the dubious honour of leading the world. When it comes to taking opioids, the United States has the dubious honour of leading the world. When it comes to taking opioids, the United States has the dubious honour of leading the world. When it comes to taking opioids, the United States has the dubious honour of leading the world. When it comes to taking opioids, the United States has the dubious honour of leading the world. When it comes to taking opioids, the United States has the dubious honour of leading the world. When it comes to taking opioids, the United States has the dubious honour of leading the world. When it comes to taking opioids, the United States has the dubious honour of leading the world. When it comes to taking opioids, the United States has the dubious honour of leading the world. When it comes to taking opioids, the United States has the dubious honour of leading the world. When it comes to taking opioids, the United States has the dubious honour of leading the world. When it comes to taking opioids, the United States has the dubious honour of leading the world. When it comes to taking opioids, the United States has the dubious honour of leading the world. When it comes to taking opioids, the United States has the dubious honour of leading the world. When it comes to taking opioids, the United States has the dubious honour of leading the world. When it comes to taking opioids, the United States has the dubious honour of leading the world. When it comes to taking opioids, the United States has the dubious honour of leading the world. When it comes to taking opioids, the United States has the dubious honour of leading the world. When it comes to taking opioids, the United States has the dubious honour of leading the world. When it comes to taking opioids, the United States has the dubious honour of leading the world. When it comes to taking opioids, the United States has the dubious honour of leading the world. When it comes to taking opioids, the United States has the dubious honour of leading the world. When it comes to taking opioids, the United States has the dubious honour of leading the world. When it comes to taking opioids, the United States has the dubious honour of leading the world. When it comes to taking opioids, the United States has the dubious honour of leading the world. When it comes to taking opioids, the United States has the dubious honour of leading the world. When it comes to taking opioids, the United States has the dubious honour of leading the world. When it comes to taking opioids, the United States has the dubious honour of leading the world. When it comes to taking opioids, the United States has the dubious honour of leading the world. When it comes to taking opioids, the United States has the dubious honour of leading the world. When it comes to taking opioids, the United States has the dubious honour of leading the world. When it comes to taking opioids, the United States has the dubious honour of leading the world. When it comes to taking opioids, the United States has the dubious honour of leading the world. When it comes to taking opioids, the United States has the dubious honour of leading the world. When it comes to taking opioids, the United States has the dubious honour of leading the world. When it comes to taking opioids, the United States has the dubious honour of leading the world. When it comes to taking opioids, the United States has the dubious honour of leading the world. When it comes to taking opioids, the United States has the dubious honour of leading the world. When it comes to taking opioids, the United States has the dubious honour of leading the world. When it comes to taking opioids, the United States has the dubious honour of leading the world. When it comes to taking opioids, the United States has the dubious honour of leading the world. When it comes to taking opioids, the United States has the dubious honour of leading the world. When it comes to taking opioids, the United States has the dubious honour of leading the world. When it comes to taking opioids, the United States has the dubious honour of leading the world. When it comes to taking opioids, the United States has the dubious honour of leading the world. When it comes to taking opioids, the United States has the dubious honour of leading the world. When it comes to taking opioids, the United States has the dubious honour of leading the world. When it comes to taking opioids, the United States has the dubious honour of leading the world. When it comes to taking opioids, the United States has the dubious honour of leading the world. When it comes to taking opioids, the United States has the dubious honour of leading the world. When it comes to taking opioids, the United States has the dubious honour of leading the world. When it comes to taking opioids, the United States has the dubious honour of leading the world. When it comes to taking opioids, the United States has the dubious honour of leading the world. When it comes to taking opioids, the United States has the dubious honour of leading the world. When it comes to taking opioids, the United States has the dubious honour of leading the world. When it comes to taking opioids, the United States has the dubious honour of leading the world. When it comes to taking opioids, the United States has the dubious honour of leading the world. When it comes to taking opioids, the United States has the dubious honour of leading the world. When it comes to taking opioids, the United States has the dubious honour of leading the world. When it comes to taking opioids, the United States has the dubious honour of leading the world. When it comes to taking opioids, the United States has the dubious honour of leading the world. When it comes to taking opioids, the United States has the dubious honour of leading the world. When it comes to taking opioids, the United States has the dubious honour of leading the world. When it comes to taking opioids, the United States has the dubious honour of leading the world. When it comes to taking opioids, the United States has the dubious honour of leading the world. When it comes to taking opioids, the United States has the dubious honour of leading the world. When it comes to taking opioids, the United States has the dubious honour of leading the world. When it comes to taking opioids, the United States has the dubious honour of leading the world.",http://www.bbc.com/news/world-us-canada-41701718,,,,,,,,,,,,,,,,,,,,,,,,,,,,,,,,,,,,,,,,,,,,,,,,,,,,,,,,,,,,,,,,,,,,,,,,,,,,,,,,,,,,,,,,,,,,,,,,,,,,,,,,,,,,,
bbc,27-Oct-17,Abortion stories: From a 'sense of relief' to a 'broken heart'," One in three women will have an abortion in their lifetime, yet it is rarely talked about. One in three women will have an abortion in their lifetime, yet it is rarely talked about. One in three women will have an abortion in their lifetime, yet it is rarely talked about. One in three women will have an abortion in their lifetime, yet it is rarely talked about. One in three women will have an abortion in their lifetime, yet it is rarely talked about. One in three women will have an abortion in their lifetime, yet it is rarely talked about. One in three women will have an abortion in their lifetime, yet it is rarely talked about. One in three women will have an abortion in their lifetime, yet it is rarely talked about. One in three women will have an abortion in their lifetime, yet it is rarely talked about. One in three women will have an abortion in their lifetime, yet it is rarely talked about. One in three women will have an abortion in their lifetime, yet it is rarely talked about. One in three women will have an abortion in their lifetime, yet it is rarely talked about. One in three women will have an abortion in their lifetime, yet it is rarely talked about. One in three women will have an abortion in their lifetime, yet it is rarely talked about. One in three women will have an abortion in their lifetime, yet it is rarely talked about. One in three women will have an abortion in their lifetime, yet it is rarely talked about. One in three women will have an abortion in their lifetime, yet it is rarely talked about. One in three women will have an abortion in their lifetime, yet it is rarely talked about. One in three women will have an abortion in their lifetime, yet it is rarely talked about. One in three women will have an abortion in their lifetime, yet it is rarely talked about. One in three women will have an abortion in their lifetime, yet it is rarely talked about. One in three women will have an abortion in their lifetime, yet it is rarely talked about. One in three women will have an abortion in their lifetime, yet it is rarely talked about. One in three women will have an abortion in their lifetime, yet it is rarely talked about. One in three women will have an abortion in their lifetime, yet it is rarely talked about. One in three women will have an abortion in their lifetime, yet it is rarely talked about. One in three women will have an abortion in their lifetime, yet it is rarely talked about. One in three women will have an abortion in their lifetime, yet it is rarely talked about. One in three women will have an abortion in their lifetime, yet it is rarely talked about. One in three women will have an abortion in their lifetime, yet it is rarely talked about. One in three women will have an abortion in their lifetime, yet it is rarely talked about. One in three women will have an abortion in their lifetime, yet it is rarely talked about. One in three women will have an abortion in their lifetime, yet it is rarely talked about. One in three women will have an abortion in their lifetime, yet it is rarely talked about. One in three women will have an abortion in their lifetime, yet it is rarely talked about. One in three women will have an abortion in their lifetime, yet it is rarely talked about. One in three women will have an abortion in their lifetime, yet it is rarely talked about. One in three women will have an abortion in their lifetime, yet it is rarely talked about. One in three women will have an abortion in their lifetime, yet it is rarely talked about.",http://www.bbc.com/news/health-41725082,,,,,,,,,,,,,,,,,,,,,,,,,,,,,,,,,,,,,,,,,,,,,,,,,,,,,,,,,,,,,,,,,,,,,,,,,,,,,,,,,,,,,,,,,,,,,,,,,,,,,,,,,,,,,
